1,Amoksiklav,Analgetik i antipiretik za smanjenje bola i groznice,acetaminofen|paracetamol|laktoza
2,Ibuprofen,NSAIL za lecenje bakterijskih infekcija,ibuprofen|laktoza|magnezijum-stearat
3,Amoksicilin,Antibiotik za lecenje bakterijskih infekcija,amoksicilin|mikrokristalnaceluloza|magnezijum-stearat
4,Amlodipin besilat,Lek za snizavanje krvnog pritiska i lečenje angine,amlodipinbesilat|laktoza|talk
5,Omeprazol,Inhibitor protonske pumpe za smanjenje zeludacne kiseline,omeprazol|natrijum-lauril-sulfat|kukuruzniskrob
6,Metformin hidrohlorid,Oralni antidiabetik za kontrolu nivoa secera u krvi,metforminhidrohlorid|povidon|magnezijum-stearat
7,Sertralin hidrohlorid,Selektivni inhibitor ponovne pohrane serotonina za lecenje depresije i anksioznosti,sertralinhidrohlorid|kalcijum-sulfat|hipromeloza
8,Metoprolol tartrat,Beta blokator za snižavanje krvnog pritiska i regulisanje srčanog ritma,atorvastatinkalcijum|laktoza|celuloza
9,Atorvastatin kalcijum,Statin za snizavanje holesterola i prevenciju kardiovaskularnih bolesti,metoprololtartrat|laktoza|talk
10,Salbutamol sulfat,Bronhodilatator za ublazavanje simptoma astme i opstrukcije disajnih puteva,salbutamolsulfat|mikrokristalnaceluloza|magnezijum-stearat